{
  "$schema": "https://json-schema.org/draft/2020-12/schema",
  "$id": "https://mailschema.org/schemas/type-contract-0.2.schema.json",
  "title": "MailSchema type contract for MAP 0.2",
  "description": "A versioned interaction contract: the details, inputs, results, authority, repeatability and consequences of each operation, with every schema it depends on pinned by digest.",
  "type": "object",
  "additionalProperties": false,
  "properties": {
    "kind": {
      "const": "MapTypeContract"
    },
    "id": {
      "type": "string",
      "pattern": "^https://mailschema\\.org/types/[a-z][a-z0-9]*(?:-[a-z0-9]+)*$",
      "maxLength": 2048
    },
    "version": {
      "type": "string",
      "pattern": "^[0-9]+\\.[0-9]+(?:\\.[0-9]+)?(?:-[a-zA-Z0-9.-]+)?$",
      "maxLength": 80
    },
    "profile": {
      "const": "https://mailschema.org/profiles/map/0.2"
    },
    "target": {
      "$ref": "#/$defs/prose"
    },
    "dependencies": {
      "type": "array",
      "minItems": 1,
      "maxItems": 20,
      "items": {
        "$ref": "#/$defs/schemaReference"
      }
    },
    "detailsSchema": {
      "type": "object"
    },
    "requestSchema": {
      "$ref": "#/$defs/schemaReference"
    },
    "operations": {
      "type": "array",
      "minItems": 1,
      "maxItems": 100,
      "items": {
        "type": "object",
        "additionalProperties": false,
        "properties": {
          "id": {
            "$ref": "#/$defs/token"
          },
          "effect": {
            "$ref": "#/$defs/prose"
          },
          "authority": {
            "type": "array",
            "items": {
              "enum": ["credential", "possession"]
            },
            "minItems": 1,
            "maxItems": 2,
            "uniqueItems": true
          },
          "consequences": {
            "type": "array",
            "items": {
              "enum": [
                "refusal",
                "protection",
                "record",
                "disclosure",
                "commitment",
                "authorization",
                "assertion"
              ]
            },
            "minItems": 1,
            "maxItems": 7,
            "uniqueItems": true
          },
          "repeatable": {
            "type": "boolean"
          },
          "fieldBindings": {
            "type": "array",
            "minItems": 1,
            "maxItems": 10,
            "items": {
              "type": "object",
              "additionalProperties": false,
              "properties": {
                "input": {
                  "$ref": "#/$defs/pointer"
                },
                "fields": {
                  "$ref": "#/$defs/pointer"
                }
              },
              "required": ["input", "fields"]
            }
          },
          "results": {
            "type": "array",
            "minItems": 1,
            "maxItems": 5,
            "items": {
              "type": "object",
              "additionalProperties": false,
              "properties": {
                "state": {
                  "enum": ["accepted", "completed", "failed", "pending", "approval-required"]
                },
                "reasons": {
                  "type": "array",
                  "items": {
                    "$ref": "#/$defs/token"
                  },
                  "minItems": 1,
                  "maxItems": 20,
                  "uniqueItems": true
                },
                "outputSchema": {
                  "type": "object"
                }
              },
              "required": ["state", "outputSchema"]
            }
          }
        },
        "required": ["id", "effect", "authority", "consequences", "results"]
      }
    }
  },
  "required": [
    "kind",
    "id",
    "version",
    "profile",
    "target",
    "dependencies",
    "requestSchema",
    "operations"
  ],
  "$defs": {
    "prose": {
      "type": "string",
      "minLength": 1,
      "maxLength": 12000,
      "pattern": "[^\\t\\n\\u000b\\f\\r \\u00a0\\u1680\\u2000-\\u200a\\u2028\\u2029\\u202f\\u205f\\u3000\\ufeff]"
    },
    "token": {
      "type": "string",
      "pattern": "^[a-z][a-z0-9]*(?:-[a-z0-9]+)*$",
      "maxLength": 100
    },
    "pointer": {
      "type": "string",
      "pattern": "^(?:/(?:[^~/]|~[01])*)+$",
      "maxLength": 1000
    },
    "schemaReference": {
      "type": "object",
      "additionalProperties": false,
      "properties": {
        "url": {
          "type": "string",
          "pattern": "^https://mailschema\\.org/schemas/[a-z0-9.-]+\\.json$",
          "maxLength": 2048
        },
        "canonicalDigest": {
          "type": "string",
          "pattern": "^sha-256:[a-f0-9]{64}$"
        }
      },
      "required": ["url", "canonicalDigest"]
    }
  }
}
